,id,subreddit,created_utc,title,selftext,permalink,num_comments
72,kpj5hn,dating_advice,Sun Jan  3 13:32:08 2021,Need some general advice on why I can't get myself a nice girl!!,"So I honestly feel I’ve got the short end of the stick, I feel like nothing will ever work out for me in a romantic point of view. I feel I can’t even get a nice lady to see me on a casual basis, let alone a life long partner or even a one night stand. End goal is a partner for life, one who will love me and have my back till the end. But I see nothing wrong with meeting some nice woman for a bit of fun or having some friends that come with obvious benefits along the way till my new partner is on the scene. But no matter what I do or try it always seems to fall short, and I can’t figure out why. This will take a little explaining so grab some snacks if you need before continuing.

Will start with some background as I feel it will help you understand my situation much better towards the end. I have aspergers, so growing up my maturity level was always several years behind my physical age. Once in my young 20’s however this problem corrected itself as I dedicated time to learning how to be social. These days I’m 34 and recently divorced (more on this later), been flying free since May 2020. I’ve put myself in social situations, joined groups for different activities, hit the bars on weekends, gotten into online dating and even had a few brave goes at flirting with some woman I liked while shopping or running everyday errands. This has got me a few first dates and some nice comments but that's about it (again little more later). I know socially I’m quite fine, few nights at the bar got me invited to some after parties, still in a lot of my group activities (EG D&amp;D and Zumba classes) and have been told by quite a few sources that I socially fit in and in no way come of as desperate, they got no reason to lie to me either. 

A little on the past now to help you see where I’m coming from. My first GF was when I was 18. Let’s say she only went out with me to break my values and ended up cheating on me for half of our 8 month relationship with my best friend. This shut me down for about 4 years as I retreated into video games and church life. Before that my school life wasn’t much better, always moving around and never settling in one place made it hard to keep friends, if I made any at all. Was always the social outcast at school, being a little chubby didn’t help. Dropped out of school before finishing grade 10 as I just couldn’t handle it anymore (met first GF at tafe). 

I finally left home around 25 and moved to the city, this is where I finally lost my virginity…… to a dam escort…. Spent the next 6 months unable to get myself any ladies and only settling for escorts. Burned through about 6 or 7K to achieve this, not a part of my life I’m proud of. I finally met my exwife not too long after this and we pretty much skipped the dating phase, engaged within 3 months, both 28 at the time. Looking back I was desperate and she was too in a way, and I know she had some kind of love for me, not too sure now what that was, but something was there. We stayed engaged for 18 months before getting married in 2015. After we got married things started decaying at a very slow speed. She was lazy, didn’t give much affection, double standards, emotionally manipulated me and the list goes on, could do a whole post on just this marriage to be honest. The sex was one of the worst (not the most, but up there). On average once every 6 weeks to 2 months and most of the time she would open her legs, jump on her phone and give me 10 minutes to do what I needed. She never really put any effort into trying to please or pleasure me. Kisses most times had to be bargained for with chores, coffee, a massage and so on… So by this point life wasn’t looking too good, but I stayed determined I could help her while fixing us, and because deep down I thought it would never get any better. I know I’m better off right now but still wonder sometimes. The catalyst for the plunge into darkness was when we lost our one and only baby. We were about 8 weeks in when we lost it, both of us being overweight didn’t really help our chances. 

This was about 2 years before I called it quits. She went into depression and started getting worse. I tried to help her however I could, we went to counselling, I tried to help her join groups to get out more, us to both lose weight and much more. She would either try for a month or so, or outright not even try at all on all these things. Always sliding back into depression. It went from depression to attention seeking but. Always posting on Facebook about how sad things are, or using depression as an excuse on me for getting out of chores, work some days, intimacy with me and the list goes on. Anytime we did things she wanted however, I cook and do the chores, holidays, go to nights out with her friends or family or anytime she got away with staying in bed all day while I did everything she suddenly wasn’t depressed. 9 months before I did leave was my first threat to leave. She picked herself up for about a month and went right back. So May this year (2020) I left. Her hanging out with some old friends, including an ex boyfriend was the straw that broke the camel's back. Saying she felt more loved there then with me, I can’t prove it but I know she cheated on me as well. 

Moved to a small country town and am currently bunking with my folks for some cheap rent and emotional support, will move out again mid next year (2021) when my work on a side project is done. I’ve already lost 22kg, got heaps of work done on my side project, got a job and saved more money in 7 months then me and the ex did in 4 ½ years of marriage. 

As I stated above I’m pretty good socially, still need to lose more weight but I’ve come a long way and now only need 3XL shirts (down from 6 and 7XL, about 139kg right now, but will admit I don’t look half bad. So my weight will play some factor, maybe. But I’ve tried with girls around my size, bigger and smaller, different ages and much more. While I’ve made some nice friends out of this it seems like if I want to break my drought I will need to start seeing escorts again, which I don’t really want to do.

Now I do have one lone exception to this. About 3 months back I met a girl at one of these after parties I went to after meeting some (now) friends at a bar after I flew solo for the night (new to town). We made a date 2 weeks later and I had what I can only describe as the best night of my life as we went for 4 hours doing things I didn’t know were possible. She chased me and led most of the night, I felt so wanted and like a man for once. That was the only oasis in a desert that has been 19 months now, my ex withheld any sex for the last year of our marriage. Now this girl might be on the cards again later, not sure right now (seems this not sure things is a norm for most the girls I’ve got any future chance with, so over the endless limbo). And I’m talking to a few other ladies and seeing what happens. But for the life of me I can’t seem to get past 1 or 2 dates with any nice woman, or so much as secure a friends with benefits arrangement or something more casual with others. 

Now I’d like to point out I’m no creep. I want anything, be it a relationship or something not as serious to be with consent from both sides, and I at least like to meet a woman for coffee before doing anything with her, or maybe meet at the bar before :D. Some of you might say I’m trying too hard, but I’m letting a life long partner come naturally and I have no intention of rushing into any relationship before giving it time and using the knowledge I gained from all my past failures to make sure I do it right this time. But in the meantime it shouldn’t be impossible to have something more casual on the side should it? 

Please feel free to ask whatever questions you like. I’m really looking for some advice on this matter as I either can’t pin what is wrong with me, am I just so damn unlucky or whatever else might be going on. 

Update - I want to repost this with an update as I’ve figured out a lot and well this has led to more questions. 

So the weekend before Christmas I spent 4 nights in a major city in my country (Australia) and every night hit the town (was in town Thursday through to Monday). Again made friends, got to hang out with different groups but never got myself so much as a little fun for a night. I also met up with a girl from a dating app I’ve been happily talking to for 2 months, we both came to this city to meetup here, let’s just say that date failed big time. More on this later. Long story short I failed again to get myself any nice lady and well….. Paid an escort to get over my frustrations. 

For Christmas I joined the family in another capital city (I live in the middle of nowhere Australia), getting here was a plot out of a movie breaking down in the outback and just making it in before Christmas day. I’m typing this while still with the family, leaving back for home in a few days. Again I tried to find a friend with some benefits and so on, usual story no luck. One of these girls was an old friend who I thought I could get with as we both had a small thing for each other when I was married, but I’m a loyal soul, so nothing happened. Not married now, lol. We hung out for a day and got very flirty in a makeout session, sadly as I’m typing this I pretty much know that is all it’s going to be. Won’t say what is going on as that is personal for her, but it’s a life situation where it makes it nearly impossible for us to be together, I did try but. I feel really unlucky.

The first place award goes to another dating site girl I met. We got along great, later coming to discover we have a lot of similar likes, values and more. I really want to continue getting to know her and see if she has potential for a partner (no rushing into any relationship, no matter how good it looks). But she sat me down and told me no spark, not yet anyways. There is a chance in the future, but her life is in such chaos right now I think any guy would have got the same treatment. Now this is where I can be at fault for a few things, but without telling you this my main point won't make any sense. So we agreed to be just friends and proceeded to hang out for 3 days over New Years, both of us not having any plans. I bunked at her house while we spent time going out to see sites, watching lots of netflix, cooking and swimming together. Despite this the only thing I did with her was makeout (not much of this after the friends chat either), she is a damn fine kisser though. We also got really deep into conversation about each other’s lives and became quick and close friends. I only met her online dating about 3 days before all this went down, so really fast and close friends. 

Thanks to her I’ve come to realize that while not desperate in social situations, once I catch a scent of maybe getting any form of intimacy the desperation comes right out. I spent plenty of time those 3 days still hitting on her for some fun, just as friends of course. Here is the stupid thing, she is a sex fanatic, but she want’s to change that about herself, so I’m so stupid for still hitting on her hoping for maybe some casual sex as just friends or pity sex maybe….. Stupid I know. I know I need to focus on myself, getting another part time job to help with income, continue to lose more weight and finally get my side project done. But I really just want a relationship or at least a nice friend who comes with benefits. If you recall, lost virginity at 25/26 to hooker and since then only known, escorts or my lack of intimacy ex wife. I know It’s a bit silly to want this when focusing on healing myself (I thought I was over my ex, but not completely as it turns out) it is a better option. But with how unlucky/lack of experience or opportunity I’ve had in this area It’s not easy to just say “well I’ll be fine with nothing for 6 months while I get the rest of my life in order.”

With that lone exception 3 months back I now realise I did play it cool on that date, I at best expected a kiss at the end of the night but got a whole night of well, lets just say it’s a night I won’t forget. My point is no expectation, gave me no desperation. I know I’ve pretty much partly already answered my own question here, which I now realise (thanks new best friend). But what can I do about the fact that for the first time in my life I’ve got the chance to have some regular intercourse and find a new loving partner, but I just can’t seem to get lucky, or my desperation kills any chance. I almost feel like I won’t last 6 months, which I need to do for my long term life to get better, I mean losing more weight will greatly help my chances. 

I on one side of the coin feel stupid for letting wanting some fun consume my brain most of the time, but on the other side know intercourse is a natural and desirable part of human life. We all crave it and we all should get to experience it, why does it seem like I can’t then. I will say this but, in the situations my desperation has shown itself only once would it have made the difference in whether I got lucky or not. Most times it’s a stupid set of unlucky circumstances that my desperation only made come to the surface faster. 

I know the whole argument for just focus on yourself and life will come along and give me this on a silver platter, but I digress. It’s eating me alive inside and I’m at my wits end on how to handle this situation. I honestly feel having a semi regular partner for some fun would go a long way to letting my brain settle down as I got something to look forward to. Is my train of thought wrong? Am I just stupid? I just don't know where or what to do right now. Sorry for the long ramble, the only way I can really get it out there. Any advice would be great please. .",/r/dating_advice/comments/kpj5hn/need_some_general_advice_on_why_i_cant_get_myself/,5
66,kqk9yg,dating_advice,Tue Jan  5 00:56:57 2021,"(M30) Never really dated, moved out of parents home for independence/confidence/dating, but family will have to live with me due to issues, how hard will dating be?","Made a throwaway for this purpose since I'm kind of shy so best to keep it anonymous. I feel like my problem needs a bit of context, it isn't as simple as what I titled this post, so let me unload a little, I hope you don't mind  


Before the pandemic I moved out of my parents home. Had it all: high paying job, car, and finally my own place. That all changed when (wait for it) the pandemic struck.   


I am still employed, thankfully, but my parents' marriage didn't survive the pandemic and are getting divorced. My step father is kind of a prick, it came to light that apparently he was having an affair. This post isn't about that though, I couldn't care less about what happens to him.

So currently looking for a place for us to all move into.

""Us"" includes my mom and my siblings (one who is college-bound this year, and one who is mentally disabled).

Before I made the decision my mom kept telling me ""everything is going to be okay"", ""you're your own man now"", ""you don't need to worry about me"", but you know I had to analyze her situation carefully:

  
\- she had been unemployed for 10 years, she was a housewife and the man she married made her leave her job because he would ""take care of her"". I'm sitting here wondering how is she going to find a place. I needed references, job history, proof of income for a crappy apartment complex to even consider me, how is she going to pull it off while staying in SoCal (oh yea I live in SoCal btw, renting really sucks here)

\- she is responsible for my brother currently, how would she pull this off without any support from anyone

\- how is my sister going to focus on college if there are struggles at home. I want her to be able to find her independence and not have to depend on anyone to achieve her own happiness. (See the first bullet point)

So I weighed the options: I could be a selfish jerk and carry on with my life, or I could be there for my family because they need me. I decided to help them in the end. I love them after all. But the decision nearly drove me insane, and I think it partly has to do with my upbringing and past experiences. Let me explain.

Now for me I was always the ""nerd"" type, in the sense that I prioritized academia first over anything, a ""try-hard"" if you will, so I never really dated during my high school years. I went through a rough patch in my life post-high school, I guess you can say real life hit me like a truck, and so I didn't start college until later in life. Still not dating during these college years because I was thinking I wasn't good enough, stupid I know.   


After college I got a job, and part of that job requires me to travel to other states to visit satellite offices. During one of these trips I more or less had a fling I found on Tinder. This was in 2019. I was on Tinder for the same reasons other people are: hookups, sex, etc. Was never really into that sort of stuff during my late teens/early 20s, but then I started craving it. Probably that part of the brain that nags us to spread our genes. Always chickened out though, but I guess being in a strange place I figured ""I can be anybody I want here, nobody knows me"", so it was easier for me to go through with it.

From the perspective of someone who never really enjoyed life in their youth, the fling was loads of fun, but then it wasn't when it ended. This was my first and only fling, it had lasted maybe like 3 or 4 days I don't remember anymore.  


Anyway, I ended up feeling terrible. Its the sort of empty feeling you get when you're hungry, so you eat to fill the void, and then when you stop eating you realize it wasn't hunger that was giving you that empty feeling.  


As you can imagine it kind of fucked me up emotionally, especially since she never spoke to me again. I don't think I was mentally mature enough for this. But I think it also helped me grow up a bit from the perspective that there is more to life than just work. But I also realized that I didn't want just flings or sex, I wanted an emotional romantic connection with someone. Someone to enjoy life with, explore, see the world.

So I calculated, and executed soon after the following year: I moved out. I always wanted to be independent, but I also figure this was the best way to increase my chances at attracting potential dates. Its kind of weird, but I can sort of perceive that in American culture it is preferred to not live with your parents when you're seriously thinking about being serious with someone. Am I right about this? I feel like its an unspoken rule. My mom has always said its alright to live with your parents, but then again we are a Mexican-American family, she is from Mexico while I was born here, so I think she perceives it as okay for you to live with your parents until well into your 40s. She's old school like that.  


Well after that I moved out, got to enjoy independence for a few months, and almost got to go out on my first date, but then I didn't (found her on match, and no because pandemic). Life is beautifully disappointing and fulfilling like that I guess.  


So at the end of the day I'm stepping up to help my family out as they would do the same for me. It isn't a question of whether I should or not. In life you don't get to decide which cards you play with, you get dealt with what you're dealt, and you just have to play it out sometimes.

Nothing is forever, my mom will most likely retire after a few years, and while she may or may not need my financial help, she will be on her own somewhere.  


I do worry about the situation with my brother. Most likely he is someone who is going to be living with me from this point on. But I'm not worried about that part, I'm worried that I'll fall in love with someone, only for the whole thing to fall apart because they might want me to put my brother somewhere, or worst yet kick him out, but I know deep down in my heart I'll kick them out to the curb before I do that to my own brother. That probably will hurt I bet.

Now remember I have never dated so I am severely inexperienced. Yes I was an idiot for not having realized this before, but that's the beauty of youth, you get to do dumb shit. I don't think flings count as dating. Coupled with the fact that my mom and siblings will be living with me in the very near future. How would I approach dating in my unique situation? Is there even a chance?

Where would I even look? I don't have that many friends anymore, didn't have that many to start with, so romantic connections via mutual friendships is not really an option for me. I tried dating apps, and while it is fun, and easy for finding casual relationships, that sort of thing isn't for me.

 I want to emphasize, I do realize that relationships do not equal happiness. I am quite content with my life as it is now. But I feel like life will be more enjoyable if I shared it with someone who is just as happy, you know.  


Thanks for reading, I already feel better from unloading this in writing, please do let me know what you think I should do. I will gladly appreciate any and all advice given to me :)",/r/dating_advice/comments/kqk9yg/m30_never_really_dated_moved_out_of_parents_home/,3
