,id,subreddit,created_utc,title,selftext,permalink,num_comments
33,l2cwnr,teenagers,Fri Jan 22 03:31:21 2021,"Some Out-Of-Context things my family, friends and I have said!","“Never too young for murder!” - Me

“Why is he wearing a condom on his head?” - My dad

“Yee-Yee, Mon’ami” - Me

“I bet you King Sombra is Purple guy” - My sister

“I got some Naysty yams, gurl”- My sister

“Now to get out without getting Peed on...” - Me

“I stabbed myself with an Eyeball!” - Me

“Why run with toast in your mouth like an anime girl, when you can run choking on a sandwich like an AMERICAN” - DumplingCat

“It’s not a sin... It’s just Illegal!” - Paradox

“I’ll eat now that Mickey’s crackhead cousin is gone” - Me

“Back to finding a Jellybean!” - Me

“Why am I emotionally attached to a Number?” - DumplingCat

“Thank goodness I’m not Moses” - Mom

“Screw the children” -Me",/r/teenagers/comments/l2cwnr/some_outofcontext_things_my_family_friends_and_i/,1
79,l2imiq,teenagers,Fri Jan 22 09:24:36 2021,ugh i feel like i’m gonna puke,"I just watched that american dad where stan takes steve to the abstinence meeting where all the dads have dating (non sexual obviously) relationships with their daughters and just realized how many times i’ve seen that and just not thought about it. Like i (thankfully) got out of my super religious school, but when I was there I heard at least 20 times at school dances that someone’s dad took their daughter to the dance and I just never put it together in my head. 

like people i actually knew thought it was cool to date their own dads. what the absolute fuck",/r/teenagers/comments/l2imiq/ugh_i_feel_like_im_gonna_puke/,6
6,l43rhs,teenagers,Sun Jan 24 19:28:55 2021,I miss the time when the back of my rough notebook looked like it belongs to American physco,"Gore, blood, weapons and all sorts of good stuff I drew.


Now it just ass,titties and my self portraits as a clown...


Idk which time was better",/r/teenagers/comments/l43rhs/i_miss_the_time_when_the_back_of_my_rough/,0
17,l45rpw,teenagers,Sun Jan 24 21:24:10 2021,I don’t like living in Spain,"Cuz they suck and they are so dumb that they colonized a whole continent and they have lost it lmao they so dumb. And their socialist ideas would make them as poor as latinoamerica but Geramany saves their ass

Si sos español, gallego trolo hijo de puta sos un pelotudo de la gran puta

With love 💕",/r/teenagers/comments/l45rpw/i_dont_like_living_in_spain/,0
22,l46et6,teenagers,Sun Jan 24 21:57:14 2021,"sorry fellas, but Shark Tale the 2004 American computer-animated comedy motion picture classic produced by DreamWorks Animation stays on during sex",,/r/teenagers/comments/l46et6/sorry_fellas_but_shark_tale_the_2004_american/,0
61,l4bjct,teenagers,Mon Jan 25 02:23:04 2021,I will take a non-biased perspective on which sex has it worse,"Firstly, we will discuss men.
Men go through a lot, people, no matter what sex, go through alot. Now let's see what men go through. They are forced to bottle down emotions which is pretty bad, (depression rates between sexes disputed so I won't touch on that) the court system heavily leans towards women, which can be very bad, a man can lose everything, and which in the same situation, a woman loses little to nothing. Men also have a few benefits, they are naturally stronger and bigger than a woman, if you put a man against a woman (average man and woman) a man will probably beat her into oblivion. So this can give men an authority complex, granted this is rare and shouldn't be a justification for hating men. 
Boys growing up also suffer problems in school, teachers are usually biased towards girls (especially if the teacher is female, if a male teacher is biased towards girls the FBI needs to be called) and the American school system is weighed more for girls to succeed, this is in Elementary school mostly. A boy once got in trouble for chewing a Pop Tart into the shape of a gun. Which is something boys are interested in. Most things boys are interested (guns, war, action, hero stories, video games) are repressed for more girl like things. Which makes things hard.

Now let's get to women, they are expected to be pretty, and are more likely to be sexually abused, and periods, oh god, periods, this shit is painful and shouldn't exist, it is the unholy spawn of Satan himself, I don't see how its possible for women to go through this shit for 10 days per month, it is painful, it shouldn't exist, it justifies why women get everything handed to them, oh god, thinking about it makes me scared.

My final verdict, men have it worse, but who cares? Men aren't people. Jk, but if any women can help expand the bad things for women list, feel free to",/r/teenagers/comments/l4bjct/i_will_take_a_nonbiased_perspective_on_which_sex/,0
51,l54r3q,teenagers,Tue Jan 26 05:07:34 2021,Why do girls get dick pics and boys dont smh,"This is not fair, gender inequality in america",/r/teenagers/comments/l54r3q/why_do_girls_get_dick_pics_and_boys_dont_smh/,0
91,l5dy6x,teenagers,Tue Jan 26 15:26:49 2021,"Wtf is this feeling, it's not possible","This guy half a world away just said he has a crush on me, even he says that it's weird to have feelings for a girl he's never seen or heard, I'm literally just a wall of text for him and he caught feelings.

Almost every boy I've talked with on here caught feelings for me sooner or later and like, I just wanna chill with guys? Talk with them? I'm not looking for a date, you know, I never really had a crush for anyone on here

But he's different than others. He's not as horny as majority here. He's not a dry texter. He's not american, surprisingly. He's not ridiculously older than I am. He's kind, caring, awesome listener and great person to talk with. For the first time in years there's someone who doesn't care about feelings much, someone I relate to.

We talked just fine, just messing around about anime, games, everyday struggles, lots of things, I thought of him as a friend, I was relaxed when I was talking with him. After he said that I'm his crush it changed. I'm getting nervous when talking to him, I play with things around me to somehow avoid? focusing just at him cause I'm worried I might ruin this.

I'm just not sure, do I like him? Or love him? Or is there a thin line between those two feelings? I can't possibly fall in love with someone I've never seen, right??",/r/teenagers/comments/l5dy6x/wtf_is_this_feeling_its_not_possible/,1
70,l6lplb,teenagers,Thu Jan 28 04:32:32 2021,Question for Americans as a European,"Why is it such a big deal to say I love you because I see in American tv shows when a couple could be going out for almost a year and they just had the best sex of their lives and one of them says I love you, and then the other speed runs a mid life crisis and nearly considers fleeing the country like jesus christ why is it so bad",/r/teenagers/comments/l6lplb/question_for_americans_as_a_european/,34
51,kv55la,memes,Mon Jan 11 17:45:45 2021,This is Yee Yee Ass Haircut can we talk about how much Americans are stupid now?,,/r/memes/comments/kv55la/this_is_yee_yee_ass_haircut_can_we_talk_about_how/,4
8,ko4s7r,dating_advice,Fri Jan  1 06:14:32 2021,(20M) got rejected really need advice please,"One day i was just browsing tinder and i found this girl [19] she lives in Germany and I live in the Netherlands. She had her instagram in her bio and i decided to message her because its easier then to get matched. We started talking about basic daily stuff asking how she was how her day was etc.

I found out she was heartbroken by a guy in Australia (probably a scammer) that just vanished. I made it my mission to make her feel happy again and it worked she started to cry less and she started to be happy again. At some point we started getting into eachother we called eachother pet names like honey, hun etc. and we really started to like eachother, i fell in love with her. We started sexting, sending pictures etc. and i really thought she loved me back untill one day i told her i loved her and she admited she couldnt say it back because she didnt felt the same for me. She admited she was using me for distraction mostly to not think about the Australian guy but she likes me but just doesn't loves me.

So i asked her what is she would want me to do, stay friends and keep just let it be friends with benefits or if she would want me to leave. She said she wanted me to stay. At some point we started talking about meeting up wich we eventually did I sat 6 hours in the train to her and 6 hours back. As you can expect we had sex and we cuddled and fell asleep together like real couples do. We talked about if one of us finds someone else they liked more we would stop doing what we were doing and stay friends. 

So fastforward to today. She told me she is starting to like a guy she met from her friendgroup and asked me to stop doing the sex stuff with her. Ofcourse I am heartbroken by this news but I knew this was gonna happen sooner or later. Did I my own grave by staying with her or was I right to stay with her. I truly dont know. 

it might be good to add that I am Chronicly depressed and I have PTSD and that I think about suicide alot. This girl was the first girl i trully loved and I know there are others out there but as someone that is depressed it can be hard to see this.
Right now i am struggling with my feelings and I don't know what is going to happen wich scares me the most. 

I know i wasn't the best person i could be to her but i tried my hardest to make her love me back so things would be easier. I guess some people aren't just ment to be together.",/r/dating_advice/comments/ko4s7r/20m_got_rejected_really_need_advice_please/,5
93,kouvrv,dating_advice,Sat Jan  2 11:47:12 2021,"I left town, got ghosted, months later got blocked on everything. Still can't get her out of my head. Advice please.","Hey guys, last year I was working remotely in another country where I met a fellow American. She was beautiful, nerdy, working for a non-profit and had a very calming presence. We met during a class and she ended up finding me on instagram later. We connected and planned to meet.

I was leaving the country in a couple weeks, she was aware of it, so I went into the date with no expectations. She showed up in a lovely dress and we really hit it off. I am not the kind of guy to believe in soulmates and I was having a blast as a single guy in other countries. But this woman had me shook.

We both had unique up-bringings, similar taste in music and most importantly what we wanted out of life (social work, adoption etc.) She constantly brought up sex but I always pivoted away - I didn't want her to be a nomadic hookup. She was too special to risk it.

On my last weekend we made a lot of plans. She was quite busy that week with work but she was more distant than usual. I wanted to discuss any potential for the future during a planned hike. She ended up canceling all weekend and asked me out for dinner the night before my flight. I told her I wasn't sure as I had a very busy day and I figured she just wasn't interested - if she liked me surely she would've wanted to spend the last weekend with me.

That day she messaged me for dinner but I was feeling very sad for leaving and her general lack of interest. I didn't respond. Next day as I boarded my plane I told her she was one of the most beautiful souls I've ever met and I didn't want our friendship to end. I told her I was asking her out on a date 2 months in advance when I'd be back. Silence. I never heard from her again. 

I left her a couple messages telling her I was sorry for blowing her off on my last day and I just couldn't say goodbye. Told her to stay safe during covid. No response. I didn't bother her further and planned on messaging her when I'd return to the country just in case she wasn't sure if I was serious. I messaged her friend to find out what was going on. No response. 

Over the next few months, covid blocked travel. I dated other women but kept thinking about her. I posted instagram stories that she and her friend viewed but that's it. One day after months of no contact, she blocked, unblocked and followed me again on IG. I thought nothing of it and followed her back. Still didn't want to be annoying and thought she would reach out if she wanted. A week later she blocked me on everything. 

I was incredibly confused. Other female friends said she must've liked me if she felt the need to block me after months of no contact. She was a very mature woman, I was quite surprised at why she couldn't even say she wasn't interested. Was I suppose to do something? 

I plan on being back in her town in a couple months as covid restrictions end. Will be there for remainder of the year. I am thinking about getting a friend to deliver a letter to her with some flowers. I am okay with her not being interested/available, I would love to still be friends with her if dating isn't an option. I care about her deeply and feel happy thinking she is safe and well. 

Any thoughts on her behavior? I realize I was a jerk for blowing her off on my last day but I corrected that within one day by apologizing. It's been 10 months since I heard from her and it still messes with me.",/r/dating_advice/comments/kouvrv/i_left_town_got_ghosted_months_later_got_blocked/,10
