,id,subreddit,created_utc,title,selftext,permalink,num_comments
22,ko1sbf,teenagers,Fri Jan  1 02:46:39 2021,All I want is a nap but these people are being stupid AS FUCK!!,"yelling, burning incense out of fucking nowhere and it blows straight into my room, putting stuff on my bed WHILE I AM SLEEPING when there’s a whole empty desk to do so, then when I wake up and close my door someone FUCKING KNOCKS LIKE THE POLICE (non Americans sorry u don’t get it our police pound on the goddamn door until it’s off the hinges) and now that I’m wide awake with an adrenaline rush ready to bash someone’s fucking head in, it’s quiet. What the fuck man. I swear I’m the only smart person in this house. Who fucking programmed these npcs. I fucking hate your guts. Im so angry dude. I’m just gonna try to stay the fuck away from these people for a couple hours. And they have this bummy ass New Years tradition that I wasn’t nothing to fucking do with. Today sucks herpes dick.",/r/teenagers/comments/ko1sbf/all_i_want_is_a_nap_but_these_people_are_being/,5
38,ko3kxh,teenagers,Fri Jan  1 04:46:35 2021,So this is my current daily routine during holidays and lockdowns:,"It's a wonder I'm alive at all but here it is (btw my school routine isn't much different):

&amp;#x200B;

Sleep at 00:00 until 12:00

Eat toast (optional)

Sit on my ass playing xbox for 5 hours

Eat chips (or fries as you american call them)

Sit on my phone or xbox until 11

Sit in bed doing whatever on my laptop for however long I feel like doing

&amp;#x200B;

So that was my routine, here's my diet worthy of my death by malnutrition:

&amp;#x200B;

Breakfast: Toast (plain, no butter, etc) - nothing else

Lunch/Dinner: Pasta or chips (again plain)

&amp;#x200B;

So yeah if I die that might be why. I'm fully serious and am open to comments.

I'm definetly deleting this in the morning",/r/teenagers/comments/ko3kxh/so_this_is_my_current_daily_routine_during/,6
75,ko7s7z,teenagers,Fri Jan  1 10:10:38 2021,Christ I bloody dispose the Pope,"First I would like the state that I do not hate Catholics or the Church. I think Catholics are some of the best people with some of the best morales. I would also like to state I don’t hate immigrants but I am heavily against  mass immigration.
But the pope is a disgrace to Christianity. He is a political tool. The pope advocates the mass immigration in Europe and America, he also supports same views about free speech of what Islamic extremist have. Don’t forget that he didn’t do anything about the greatest sex scandal in history, instead he decided to cover it up. 
If you’re wondering why I’ve posted here it’s because most teens don’t bother to look into him, he is disgusting.",/r/teenagers/comments/ko7s7z/christ_i_bloody_dispose_the_pope/,13
17,koqq68,teenagers,Sat Jan  2 06:27:10 2021,I've finally spent enough time on english learning subs to find the weirdest post,"A guy asked what ""That dick doe"" meant cause he's Italian and he's having sex with an American girl and she said that in bed.",/r/teenagers/comments/koqq68/ive_finally_spent_enough_time_on_english_learning/,5
96,kpdtdl,teenagers,Sun Jan  3 06:39:51 2021,"Guess what guys, ALL. LIVES. MATTER.","Ive seen some just black lives matter posts, one of which saying  
 *That’s it. Period. No amount of racism is ok, not ever. Being racist makes you scum of the earth. Racism has hurt so many, ESPECIALLY BIPOC in america. I cannot stress it enough, racism is horrible, it’s terrible. If you aren’t actively combating racism, you’re just as bad as racists. Silence is violence. BLACK LIVES MATTER. To all the triggered fragile white men who will inevitably brigade this comments section, FUCK YOU WE WILL NOT STAND FOR HATE. ✊🏿✊🏿✊🏿✊🏿✊🏿 ACAB, DEFUND THE POLICE, FUCK THE POLICE, SAY THEIR NAMES, BLACK LIVES MATTER.*

*P.S. Mods, if you really stand AGAINST hate, you will support this thread. Time to see if this sub is another hate sub or not...*

*Edit: It has become very apparent to me that this sub is very much not anti hate.*

but in my opinion, looks like this  
 *Guess what dude, ALL. LIVES. MATTER.*

*that is it period. True that racism is not ok, but that doesnt mean signal out one race. Signaling out just one race is a bit scummy dont you think? Yeah racism hurts a lot of people, but doesnt mean signal out one group of people just because they happen to be a different color. Even if people arent for/agains racism doesnt make them as bad as racists, it doesnt change them. And just bc people dont have say, doesnt make it violence, i dont give much say but that doesnt mean anything. Yeah, black lives matter, but so do everyone else. and you say as you like, go ahead say fuck the police and see what becomes of your sorry ass when things get fucked.*

*All lives matter, fight me. and not all of us are racist and think different of those who are different. Please just look at both sides of the argument*

So yeah, all lives matter guys. Yes there has been unfair incidents in the past, but the past is behind us. Dont you want to have a future without grudges?",/r/teenagers/comments/kpdtdl/guess_what_guys_all_lives_matter/,20
70,kpi2r9,teenagers,Sun Jan  3 12:02:08 2021,We can settle the Canada vs America argument once and for all,American average dick size 5.1 inches and the canadian average Dick size 5.5 inches therefore 🇨🇦&gt;🇺🇸,/r/teenagers/comments/kpi2r9/we_can_settle_the_canada_vs_america_argument_once/,32
90,kq6h5c,teenagers,Mon Jan  4 12:56:15 2021,Why I feel like I'm treated badly.,"A warning: This post includes my views about culture, gender, sex and race, in relation to me. I'm not here to say that any of these things are entirely bad, just give my views on them and get some help with it.

Recently, I've seen a lot of things posted on reddit and twitter about feminism and I dont understand why it exists like it does. For example, Ive seen people saying stuff along the lines of 'A good relationship includes: Putting your wife first, above your parents, survival etc, worshipping your wife and (paraphrasing) bending to her will and I think its bullshit. None of those conditions sound lile an equal relationship. Why do feminists want equal rights when they try to opress men to nothing. It doesnt make sense, and they dont stop to question what they are doing, and with most people these days, jump to conclusions before thinking.

Im not saying feminism is bad, I think they should have  the same rights, *and* responsibilities as men. I think the strongest example I've seen proving extremes are taken, is a dispute a bunch of year 7 students had over womens rights. Take these with a grain of salt as most of the arguments given here are quit dumb. These quotes are not exact.

'At least women dont choose to become dirty, grubby tradies like men'. I had to start with this one because it pisses me off. I live in Australia, and as far as I'm aware, we have hundreds of thousands of tradeswomen at work. And, without these workers, the jobs that women 'choose' to do cant function.

'Men dont have it hard, women get raped so much and men dont' Yes, women get raped more then men and according to the western australian goverments heath department, more that 700 thousand women get raped compared to men. But that doesnt change the fact that women are as much at fault here than men.

Rasicm. Please. Stop. All of you. Every single person on this planet, needs to think about what they are saying. For several reasons. Lets start with my opinion on the topic, dark skinned people (unsure of the polite term) are racist too. Sure, caucasians are racist sometimes. But that doesnt mean that the victim is innocent. Calling the police on a dark skinned person is not racist, if they did something wrong. Same for fair skinned people. White supremacy is no longer a thing. It was pre 1960s (may be different depending on your country) but thats long changed. Who gives a shit what colour you are, if you knew me, and painted myself black, you wouldnt treat me differently. All our choices come from an internal part of the body, which cant be seen and we should not let our visuals affect us. Racism is bad, but we are shooting the wrong enemy.

As for gender...
Why should we give two figs about what someone thinks they are and why should they give two figs about what someone else thinks they are.

'You should be ashamed for being straight, all you think   about is fucking women and its gross. You being straight is a disgrace to human society.' 
I got told this, to my face. This is a blatent example of stupidity. It doesnt matter if your part of the LGBTQ+ community, or straight. If your a different sex, or gender. You have no right, whatsoever to say this to *anyone*. Its rude. And it gives me a bad view of your community.

My problem:
If you read all of that, kudos. I may have bias views on some things, maybe i didnt clarify enough or I just dont agree with you, but thats ok. These are my thoughts.

I want to know why this happens and why people give me, a Caucasian male, shit about it. Please share your thoughts with me.

'Only mind, not mine'
Figure out this riddle, if you can.

Thankyou for listening.",/r/teenagers/comments/kq6h5c/why_i_feel_like_im_treated_badly/,17
8,kq97x7,teenagers,Mon Jan  4 15:57:30 2021,"[15M] HELLO, BE MY FRIEND. Not convinced yet? Fine, prepare to succumb to my AMAZING persuasion skills :3","*Ik this looks like a lot of text, BUT I SWEAR ITS NOT ITS QUICK TO READ!!! :3*

**A fewwwww disclaimers first :)))**  
I'm 15, male, and Aussieeeee  
Uhm if I eeeever upset you or anything please let me know, I hate hurting people and cant stop if you dont tell me :(  
As much as I joke, I dont want to mislead. So I just wanna let you know that I'm not big and strong and scary, I'm skinny ish, verrrry submissive (in just about any way possible) and ngl, very weak LOL

**Pros about me :3**  
I tryyyyy to be chill  
I've got pets :333  
I can be VERY affectionate :3  
*I will be any dom girl's personal fu- WHOOPS I SAID NOTHING*  
I dont judge people on ANYTHING, thats just cruel :(

**Cons about me :((**  
If I click with you I may get very attached :( this means HEAPS of affection, I get very sad if you ghost :(( aaaand I'm easily manipulated cause I'd be scared of disappointing you or making you sad lol (SO PLEASE GO EASY ON ME)  
I can be a little sensitive if you're GENUINELY mean to meeee, so please dont unless I REALLY deserve it :)

**About you :p**  
Ok well, ik this sounds weird but I'd like you to be a girl. No not because I’m looking for anything sexual persay. Buuuut I tend to have more fun with girls and we click WAYmore :), please don’t think I’m a creep :(  
I don’t really mind that much about age at all, as long as we work /click well, well that's what I’m looking forrrrr! :))  
Ikkkk this is probably obvious, but supportive, caring, and just kind people are so fucking great :) please be like that I’ll love you forever lmaooooo &lt;3  
Oh and also please protect me from mean people :333

TYSMMMMMMM if you actually read all that or even some. If you think we would be good friends, please dm or comment :3333

If you wanna know EVEN MORE!!! I have some slides pinned to my profile with HEAPS of info :)",/r/teenagers/comments/kq97x7/15m_hello_be_my_friend_not_convinced_yet_fine/,37
1,kqmi7m,teenagers,Tue Jan  5 02:48:36 2021,Yay woohooo parents supper arrived yay at yipee,"I’m about 11 into piano and will be doing a level 10 RCM(royal conservatory of music) exam soon. This year was special since we have a bit of a virus situation so they guys at RCM let us record our entire music and send it over by video ( I’m not gonna explain it’s complicated). Of course like any person would, I tend to get nervous whenever the real thing comes around. And OH BOY LUCKY ME! My parents, 2 unbelievably enthusiastic belittlers just decide to start their ritual of démoralisation on me. (My ass got nervous and fucked up many pieces) My exam is barely in 3 weeks and they decide to pull this shit. Not in one of those 6 years of piano exams and competitions have they said something wee bit positive about my accomplishments. No “nice job man, I’m proud of you, keep it up buddy” no none of that shit. It’s just “So you have the face to go to the exam with this trash?” “Unbelievably garbage why aren’t you improving” 
Like I swear to god those mfs like the Gordon Ramsay of piano yet have ZERO FUCKING EXPERIENCE in such. They have no experience on piano or music yet have the audacity to criticize my playing. I’m not even that good honestly but I still have the respect to sit down and think of what I did wrong instead of shooting myself in the head (figurative). 



To the Americans of r/teenagers, tell me which caliber kills the easiest to the head. (Preferably pistol like .45, 9mm, .40 magnum) I’m so fucking done.",/r/teenagers/comments/kqmi7m/yay_woohooo_parents_supper_arrived_yay_at_yipee/,4
60,kqtd9s,teenagers,Tue Jan  5 09:35:12 2021,justifying being a lazy piece of shit - apparently writing a rant has become a nightly occurrence in my life," “Lazy” used to be such a clear cut term for me. It was so black and white. To me, being lazy was simply a choice. That choice was a reflection of your character, of your worth to society. I’d hold myself in such high esteem for being prototypically “smart” and “hard working”. That quickly changed in 8th grade where all of a sudden the idea of work filled my mind with disgust and contempt. Who knows what changed in me, but from that point on I’ve avoided schoolwork like the plague. Any attempt at putting in any semblance of effort is quickly thwarted by some easily accessible meaningless distraction. Naturally, my parents quickly started putting more pressure on me and I was wracked with guilt as a result. Yet despite all this guilt and pressure, I somehow managed to start doing even less. The guilt transformed into self hate which started manifesting itself through all kinds of negative, self deprecating thoughts. Eventually I began to reciprocate these shitty thoughts through self harm. All I remember is endlessly pinching myself and running this exacto knife I’d found against my skin as I spiralled down the rabbit hole of overwhelming emotion every night. 

Enough of this pussy ass sob story, where the fuck am I going with this? I think my initial idea was to pour out my thoughts regarding “motivation” and what a shitty work mentality society perpetuates. It’s almost like “grinding” and overworking yourself is fetishized these days. The conversation amongst my nerdy college board dick sucking group of friends would endlessly revolve around what work they had to do and what work they’d already done while I sat there figuring out how I was gonna pass biology. Who knows how this mindset came about, it probably has something to do with the advancement of technology and increased need for specialized fields which necessitated college degrees. The American mentality being something along the lines of “work hard, get rewarded” meant going to college was your pipeline out of financial mediocrity. Furthermore the influx of demand for college degrees only fostered unhealthy competition which paved the path for stupid AP courses and endless extracirriculars so that you could have a leg up above your competition. What happened to the 50s and being able to support a family on the salary of a car mechanic? Anyhow, I’m too uneducated to continue speaking on this subject because I’m sure there’s some economics professor out there willing to write a thousand word book on this topic. I’m probably half wrong about the whole thing anyway. Only thing I do know is that society disgustingly fetishizes work. 

So now that I’ve established the fact that our society facilitates a toxic work mentality, I’m gonna delve into my nonsensical ramblings about how motivation is intrinsic, and not necessarily a choice. Hell, nothing is a choice. Surely we are all just a product of an inconceivable amount of variables that dictate every little decision in our life, but the thought of free will not existing is just depressing. My mom says “None of us like to work, but we do it anyway because we know it's necessary to sustain a happy lifestyle”. But I can tell myself that I need to work for my own sake, I can feel all the guilt in the world for procrastinating, but at the end of the day if that doesn’t trigger the desire to do work, what will? I don’t want to deflect accountability for being a lazy person, but seriously, how can I force myself to work? Is it not just an intrinsic desire that is activated through some seemingly infinite amount of variables in your life? And sure, objectively speaking, working hard makes you a better human. That’s understandable, but how can you berate me and pressure me when it’s clear nothing is going to magically activate my intrinsic motivation. Just accept that I do not function like other productive individuals and let me live out my sad life working at Walmart. Quit fucking antagonizing me. It’s up to me to do something with my life, and ultimately working hard my entire life to have a job I hate isn’t gonna make me any happier than working 40 hours a week at Walmart living in a flat with some dirty ass hobo roommate. We all work our shitty lives away so that we can survive and reproduce, let me choose how the fuck I’m gonna do it. 

Well I’m not sure if this entire rant made sense. There is always some different way to analyze something, some way to manipulate words to follow whatever narrative you want them to. You can justify just about anything, and this is just my way of justifying why I’m a lazy little fuck.",/r/teenagers/comments/kqtd9s/justifying_being_a_lazy_piece_of_shit_apparently/,2
83,kqyk7s,teenagers,Tue Jan  5 15:34:53 2021,The Greatest and Most Epic Anime Battle to Ever Exist,"So it began on a warm Australian night. Me and my bro are doing the last chores before bed. I'm about to go brush my teeth when my bro challenges me to a 1v1 by kicking his foot up my arse. ""Exposition flashback"" My younger bro is extremely buff after deciding that he wanted to become the hulk when he was 4, prayed to god to let this happen, and has gymed every day since then to improve his strength, while i played New Super Mario Bros on the ds and improved in intellect rather than strength. So knowing full well i was at a physical  disadvantage went to even the playing fields by giving him a sacc tap, but his beefy arse fore arm swung at the same to hit me with a wooden stick, my hand bent back to a point i felt immense pain for a good 5 minutes. Now fun fact, whilst a may be weaker, i have a far greater pain thresh hold than my bro, and thanks to newtons third law of physics, he felt both the force of my wrist flick and some of the force of his thicc ass fore arm. He yelped in pain, and was destracted just long enough for me to use the secret joestar technique, GTFO and get to the kitchen and open living room. He returned faster than i thought, but that was not the problem, the problem was, the thick, plastic, bendy straw he was holding. Similarly to you, ""how could this straw do any damage"", well i gound out after it firt hit it stung, it really stung and it was fast enough that it could both combo and avoid being grabbed, so i grabbed a blanket and threw it at him. He swung wildly un able to hit me, i then hit him with a sacc tap, and nothing. He threw away the blanket and said, ""I perceived your attack"", as he jumped onto the couch, revealing his three pairs of underpants, ""it's over, I have the high ground"", did i just get out smarted, no becuase i put smarted his out smarting. ""I wonder where you straw went"" i said, he looked around his person confused, i whipped out the straw and threw it far away, and then he body slammed me. He weighs 63.65 kg of pure muscle at 165 cm tall where as i weigh 57 kg at 175.5 cm tall, so his height to thicc ratio is definitely more impressive than mine, so to say i was getting my cheeks clapped is an understatement. See my bro was doing this all shirtless (no homo, no chromo), and he had one weakness exposed, the nips, so i twisted those nips until he rolled over. We both stood up in pain and in shamble, knowing that is would not end I had to follow my life motto and my special attack, the only attack known to mankind that can both assert dominance and cause your enemy to retreat. I pulled down my pants and started to helicopter my cock, thats right my life motto is if in doubt whip it out, he was so intimidated that he screamed ""I surrender"" and ran to his room. I stood victorious.

TLDR: Read the post you lazy shit.

DISCLAIMER: This is not abuse and is fun, for all parties involved and is a fun activity in Australia we call beating the shit out of each other for fun and if you can't accept it then your a pussy. Me and the boys to this alot as well.",/r/teenagers/comments/kqyk7s/the_greatest_and_most_epic_anime_battle_to_ever/,0
24,kr6c45,teenagers,Tue Jan  5 21:59:31 2021,Is it normal to have a crush like this on celebrity’s?,"I have one fantasy about Nikki Minaj.

I have one fantasy about Nikki Minaj. I want to somehow be noticed by her and she'll fall in absolute love with me and we become lovers. Then one day we go on a cruise and the ship sinks and by some miracle we are the only 2 that survive and we end up swimming to an island with food and water resources. Enough to survive long enough and we would pass the few weeks by having sex the entire time. Eventually some wreckage would wash up and it would be enough to build a float and navigate our way back to land, the only catch is, its only big enough for one person. I sacrifice myself and let Nikki use the float to get back to land in America. With my remaining resources, I survive another 6 months and end up being saved by fishermen. They take me back to America. While on the boat I turn on the news and I see an interview of Nikki saying how she's the only person who survived and how she did it by swimming to an island and she exaggerates about how harsh it was by herself and how she built a raft by herself and floated back. She totally leaves me out of the story and mentions how she hates men and didn't need one to help her on the island. She becomes an icon for strong independent women, and has an album about it and it sells out shows across the country. Outraged, i find the next concert and find out what hotel she's staying at and what room. I sneak into her room and wait for her to return after the show. She sees a sillhouette in a spinny chair and asks ""who's there? I'm gonna call security"" then i spin around revealing its me and she is in complete awe. After some catching up, we spend the rest of the night drinking and fucking. As i'm railing her from behind, I approach the greatest nut ever so I pull out and hotdog my dick between her giant ass and right as I'm cumming, i grab the lamp off of the nightstand and cave her skull in

That would be pretty cool I think",/r/teenagers/comments/kr6c45/is_it_normal_to_have_a_crush_like_this_on/,12
55,kr9vbj,teenagers,Wed Jan  6 00:46:10 2021,british accent,as an american i’m inclined to think they’re sexy and exotic.,/r/teenagers/comments/kr9vbj/british_accent/,29
6,krhpdd,teenagers,Wed Jan  6 07:57:12 2021,Is it illegal for a 15 year old to be in a CONSENSUAL relationship with an 18 year old (please read),"So I'm 15, and my girlfriend is 17, soon to be 18. It's long distance, shes in australia I'm in canada, and im slightly worried that once she turns 18 we'll get in trouble. Theres nothing sexual, we both agreed on nothing sexual until we're both of age, it's just a relationship, nothing more nothing less, and its consented between both of us? Since nothing sexual is going on, this isnt illegal, right?",/r/teenagers/comments/krhpdd/is_it_illegal_for_a_15_year_old_to_be_in_a/,30
